<?xml version="1.0" encoding="UTF-8"?>
<datapackage xmlns:xsi="http://www.w3.org/2001/XMLSchema-instance"
	xsi:noNamespaceSchemaLocation="datapackage.xsd">
	<define type="int">
		<define-command name="pong" value="0">implement.client.datapackage.PongData</define-command>
		<define-command name="ping" value="1">implement.client.datapackage.PingData</define-command>
		<define-command name="receive_message" value="2">implement.client.datapackage.MessageData</define-command>
		<define-command name="send_message" value="3">implement.client.datapackage.MessageData</define-command>
		<define-command name="contact" value="4">implement.client.datapackage.ContactData</define-command>
		<define-command name="file" value="5">implement.client.datapackage.FileData</define-command>
		<define-command name="disconnect" value="6">implement.client.datapackage.DisconnectData</define-command>
		<define-command name="listnumber" value="7">implement.client.datapackage.ListNumberData</define-command>
		<define-command name="test" value="10">implement.client.datapackage.TestData</define-command>
		<define-command name="result" value="11">implement.client.datapackage.ResultData</define-command>
	</define>

	<command value="0"></command>

	<command value="1"></command>

	<command value="2">
		<data name="user" type="int"></data>
		<data name="message" type="String"></data>
	</command>

	<command value="3">
		<data name="user" type="int"></data>
		<data name="message" type="String"></data>
	</command>

	<command value="4">
		<data name="contacts" type="List" elementtype="client.datapackage.Contact">
			<element name="name" type="String"></element>
			<element name="phone" type="String"></element>
			<element name="email" type="String"></element>
		</data>
	</command>

	<command value="5">
		<data name="file" type="file"></data>
	</command>

	<command value="6">
	</command>

	<command value="7">
		<data name="listnumber" type="list" elementtype="double">
			<element name="number" type="double"></element>
		</data>
	</command>

	<command value="10">
		<data name="number" type="long" breakvalue="0"></data>
		<data name="name" type="string"></data>
		<data name="message" type="string"></data>
	</command>

</datapackage>