<?xml version="1.0" encoding="UTF-8"?>
<datapackage xmlns:xsi="http://www.w3.org/2001/XMLSchema-instance"
	xsi:noNamespaceSchemaLocation="jar:file:/C:\Users\Paul Mai\.m2\repository\logia\logia-socketio\0.0.2\logia-socketio-0.0.2-sources.jar!/logia/io/define/datapackage.xsd">
	<define>
		<define-command name="pong" value="0">client.datapackage.PongData</define-command>
		<define-command name="ping" value="1">client.datapackage.PingData</define-command>
		<define-command name="receive_message" value="2">client.datapackage.MessageData</define-command>
		<define-command name="send_message" value="3">client.datapackage.MessageData</define-command>
		<define-command name="contact" value="4">client.datapackage.ContactData</define-command>
		<define-command name="file" value="5">client.datapackage.FileData</define-command>
		<define-command name="disconnect" value="6">client.datapackage.DisconnectData</define-command>
		<define-command name="listnumber" value="7">client.datapackage.ListNumberData</define-command>
		<define-command name="ping" value="1001">client.datapackage.TestData</define-command>
	</define>

	<command value="0"></command>

	<command value="1"></command>

	<command value="2">
		<data name="user" type="int"></data>
		<data name="message" type="String"></data>
	</command>

	<command value="3">
		<data name="user" type="int"></data>
		<data name="message" type="String"></data>
	</command>

	<command value="4">
		<data name="contacts" type="List" elementtype="client.datapackage.Contact">
			<element name="name" type="String"></element>
			<element name="phone" type="String"></element>
			<element name="email" type="String"></element>
		</data>
	</command>

	<command value="5">
		<data name="file" type="bytearray"></data>
	</command>

	<command value="6">
	</command>

	<command value="7">
		<data name="listnumber" type="list" elementtype="double">
			<element name="number" type="double"></element>
		</data>
	</command>

	<command value="1001">
		<data name="number" type="long" breakvalue="0"></data>
		<data name="name" type="string"></data>
		<data name="message" type="string"></data>
	</command>

</datapackage>